title,id,funding_type,program,status,grant_or_tender,topic,deadline_model,opening_date,closing_date
Robust Knowledge and Know-How transfer for Key-Deployment Pathways and implementation of the EU-CEM (CCAM Partnership),HORIZON-CL5-2024-D6-01-05,Call for proposal,Horizon Europe (HORIZON),Forthcoming,Grant,HORIZON Coordination and Support Actions,single-stage,07 May 2024,5 September 2024 17:00:00 Brussels time
Improved transport infrastructure performance – Innovative digital tools and solutions to monitor and improve the management and operation of transport infrastructure,HORIZON-CL5-2024-D6-01-08,Call for proposal,Horizon Europe (HORIZON),Forthcoming,Grant,HORIZON Innovation Actions,single-stage,07 May 2024,5 September 2024 17:00:00 Brussels time
"Ensuring the safety, resilience and security of waterborne digital systems",HORIZON-CL5-2024-D6-01-10,Call for proposal,Horizon Europe (HORIZON),Forthcoming,Grant,HORIZON Research and Innovation Actions,single-stage,07 May 2024,5 September 2024 17:00:00 Brussels time
"Centralised, reliable, cyber-secure & upgradable in-vehicle electronic control architectures for CCAM connected to the cloud-edge continuum (CCAM Partnership)",HORIZON-CL5-2024-D6-01-01,Call for proposal,Horizon Europe (HORIZON),Forthcoming,Grant,HORIZON Research and Innovation Actions,single-stage,07 May 2024,5 September 2024 17:00:00 Brussels time
"Optimising multimodal network and traffic management, harnessing data from infrastructures, mobility of passengers and freight transport",HORIZON-CL5-2024-D6-01-06,Call for proposal,Horizon Europe (HORIZON),Forthcoming,Grant,HORIZON Research and Innovation Actions,single-stage,07 May 2024,5 September 2024 17:00:00 Brussels time
Scaling up logistics innovations supporting freight transport decarbonisation in an affordable way,HORIZON-CL5-2024-D6-01-07,Call for proposal,Horizon Europe (HORIZON),Forthcoming,Grant,HORIZON Innovation Actions,single-stage,07 May 2024,5 September 2024 17:00:00 Brussels time
Policies and governance shaping the future transport and mobility systems,HORIZON-CL5-2024-D6-01-09,Call for proposal,Horizon Europe (HORIZON),Forthcoming,Grant,HORIZON Research and Innovation Actions,single-stage,07 May 2024,5 September 2024 17:00:00 Brussels time
AI for advanced and collective perception and decision making for CCAM applications (CCAM Partnership),HORIZON-CL5-2024-D6-01-04,Call for proposal,Horizon Europe (HORIZON),Forthcoming,Grant,HORIZON Research and Innovation Actions,single-stage,07 May 2024,5 September 2024 17:00:00 Brussels time
Call for Expression of Interest for Travel Vouchers to attend the IN TRANSIT Matchmaking & Info Day in Graz,In Transit,Cascade funding,Horizon Europe (HORIZON),Forthcoming,Grant,HORIZON-CL4-2022-RESILIENCE-01-26,single-stage,28 February 2024,8 April 2024 17:00:00 Brussels time
DACCS and BECCS for CO2 removal/negative emissions,HORIZON-CL5-2024-D3-02-12,Call for proposal,Horizon Europe (HORIZON),Forthcoming,Grant,HORIZON Innovation Actions,single-stage,17 September 2024,21 January 2025 17:00:00 Brussels time
