title,id,funding_type,program,status,grant_or_tender,topic,deadline_model,opening_date,closing_date
Topic 3 Focus topic on “Service Oriented Framework for the Software Defined Vehicle of the future”,HORIZON-JU-Chips-2024-1-IA-T3,Call for proposal,Horizon Europe (HORIZON),Open for submission,Grant,HORIZON JU Innovation Actions,two-stage,06 February 2024,14 May 2024 17:00:00 Brussels time
HORIZON-JU-Chips-2024-2-RIA Topic 1Global call according to SRIA 2023,HORIZON-JU-Chips-2024-2-RIA-T1,Call for proposal,Horizon Europe (HORIZON),Open for submission,Grant,HORIZON JU Research and Innovation Actions,two-stage,06 February 2024,14 May 2024 17:00:00 Brussels time
India-EU,HORIZON-EUROHPC-JU-2023-INCO-06-01,Call for proposal,Horizon Europe (HORIZON),Open for submission,Grant,HORIZON JU Research and Innovation Actions,single-stage,06 February 2024,7 May 2024 17:00:00 Brussels time
Topic 1 Global call according to SRIA 2024,HORIZON-JU-Chips-2024-1-IA-T1,Call for proposal,Horizon Europe (HORIZON),Open for submission,Grant,HORIZON JU Innovation Actions,two-stage,06 February 2024,14 May 2024 17:00:00 Brussels time
Topic 2 Focus topic on “High Performance RISC-V Automotive Processors supporting SDV”,HORIZON-JU-Chips-2024-1-IA-T2,Call for proposal,Horizon Europe (HORIZON),Open for submission,Grant,HORIZON JU Innovation Actions,two-stage,06 February 2024,14 May 2024 17:00:00 Brussels time
Topic 2 Focus topic on “Sustainable and greener manufacturing”,HORIZON-JU-Chips-2024-2-RIA-T2,Call for proposal,Horizon Europe (HORIZON),Open for submission,Grant,HORIZON JU Research and Innovation Actions,two-stage,06 February 2024,14 May 2024 17:00:00 Brussels time
Joint call with Korea,HORIZON-JU-Chips-2024-3-RIA,Call for proposal,Horizon Europe (HORIZON),Open for submission,Grant,HORIZON JU Research and Innovation Actions,single-stage,06 February 2024,14 May 2024 17:00:00 Brussels time
ICAERUS PUSH 2 Open Call for Innovation Development,ICAERUS,Cascade funding,Horizon Europe (HORIZON),Open for submission,Grant,HORIZON-CL6-2021-GOVERNANCE-01-21,single-stage,02 February 2024,7 May 2024 17:00:00 Brussels time
"Development of technical and business solutions to optimise the circularity, resilience, and sustainability of the European battery value chain (Batt4EU Partnership)",HORIZON-CL5-2024-D2-01-03,Call for proposal,Horizon Europe (HORIZON),Open for submission,Grant,HORIZON Research and Innovation Actions,single-stage,07 December 2023,18 April 2024 17:00:00 Brussels time
Open Call for End-Users (Call for Art-Driven Experiments – 1st stage),Hungry EcoCities,Cascade funding,Horizon Europe (HORIZON),Open for submission,Grant,HORIZON-CL4-2021-HUMAN-01-21,single-stage,15 February 2024,15 May 2024 17:00:00 Brussels time
"Pilot Cities Programme : Call for Pilot Cities, Cohort 3 (2024)",SGA-NZC,Cascade funding,Horizon Europe (HORIZON),Open for submission,Grant,HORIZON-MISS-2022-CIT-SGA,single-stage,16 January 2024,18 March 2024 17:00:00 Brussels time
TARGET-X Second Open Call,TARGET-X,Cascade funding,Horizon Europe (HORIZON),Open for submission,Grant,HORIZON-JU-SNS-2022-STREAM-D-01-01,single-stage,06 December 2023,6 March 2024 17:00:00 Brussels time
"Community Program of OpenWebSearch.EU Project: 3rd Open Call for the Third-Parties ""Data Centre on-boarding""",OpenWebSearch.EU,Cascade funding,Horizon Europe (HORIZON),Open for submission,Grant,HORIZON-CL4-2021-HUMAN-01-05,single-stage,20 February 2024,4 April 2024 17:00:00 Brussels time
Community Program of OpenWebSearch.EU Project: 2nd Open Call for the Third-Parties 'Applications of an Open Web Index',OpenWebSearch.EU,Cascade funding,Horizon Europe (HORIZON),Open for submission,Grant,HORIZON-CL4-2021-HUMAN-01-05,single-stage,20 February 2024,4 April 2024 17:00:00 Brussels time
"Developing novel, innovative HIV therapeutics for reducing the disease burden of HIV in sub-Saharan Africa",HORIZON-JU-GH-EDCTP3-2024-01-01-two-stage,Call for proposal,Horizon Europe (HORIZON),Open for submission,Grant,HORIZON JU Research and Innovation Actions,two-stage,18 January 2024,4 April 2024 17:00:00 Brussels time
Global Health EDCTP3 JU training fellowship with return phase,HORIZON-JU-GH-EDCTP3-2024-02-01-two-stage,Call for proposal,Horizon Europe (HORIZON),Open for submission,Grant,HORIZON JU Coordination and Support Actions,two-stage,18 January 2024,4 April 2024 17:00:00 Brussels time
Innovative digital health solutions for sub-Saharan Africa,HORIZON-JU-GH-EDCTP3-2024-01-06-two-stage,Call for proposal,Horizon Europe (HORIZON),Open for submission,Grant,HORIZON JU Research and Innovation Actions,two-stage,18 January 2024,4 April 2024 17:00:00 Brussels time
"S+T+ARTS Prize 2024 - Grand prize of the European Commission honoring Innovation in Technology, Industry and Society stimulated by the Arts",STARTS,Cascade funding,Horizon Europe (HORIZON),Open for submission,Grant,HORIZON-CL4-2023-HUMAN-01-82,single-stage,15 January 2024,12 March 2024 17:00:00 Brussels time
Open Call for End-Users (Call for Art-Driven Experiments – 1st stage),Hungry EcoCities,Cascade funding,Horizon Europe (HORIZON),Open for submission,Grant,HORIZON-CL4-2021-HUMAN-01-21,single-stage,15 February 2024,15 May 2024 17:00:00 Brussels time
"Pilot Cities Programme : Call for Pilot Cities, Cohort 3 (2024)",SGA-NZC,Cascade funding,Horizon Europe (HORIZON),Open for submission,Grant,HORIZON-MISS-2022-CIT-SGA,single-stage,16 January 2024,18 March 2024 17:00:00 Brussels time
TARGET-X Second Open Call,TARGET-X,Cascade funding,Horizon Europe (HORIZON),Open for submission,Grant,HORIZON-JU-SNS-2022-STREAM-D-01-01,single-stage,06 December 2023,6 March 2024 17:00:00 Brussels time
"Community Program of OpenWebSearch.EU Project: 3rd Open Call for the Third-Parties ""Data Centre on-boarding""",OpenWebSearch.EU,Cascade funding,Horizon Europe (HORIZON),Open for submission,Grant,HORIZON-CL4-2021-HUMAN-01-05,single-stage,20 February 2024,4 April 2024 17:00:00 Brussels time
Community Program of OpenWebSearch.EU Project: 2nd Open Call for the Third-Parties 'Applications of an Open Web Index',OpenWebSearch.EU,Cascade funding,Horizon Europe (HORIZON),Open for submission,Grant,HORIZON-CL4-2021-HUMAN-01-05,single-stage,20 February 2024,4 April 2024 17:00:00 Brussels time
SESAR Engage 2 KTN – Call for PhDs in the domain of air traffic management (ATM),Engage 2,Cascade funding,Horizon Europe (HORIZON),Open for submission,Grant,HORIZON-SESAR-2022-DES-ER-01-WA3-1,single-stage,18 December 2023,2 April 2024 17:00:00 Brussels time
Advanced battery system integration for next generation vehicles (2ZERO Partnership),HORIZON-CL5-2024-D5-01-03,Call for proposal,Horizon Europe (HORIZON),Open for submission,Grant,HORIZON Research and Innovation Actions,single-stage,07 December 2023,18 April 2024 17:00:00 Brussels time
Quantum sensing and metrology for market uptake (IA),HORIZON-CL4-2024-DIGITAL-EMERGING-01-45,Call for proposal,Horizon Europe (HORIZON),Open for submission,Grant,HORIZON Innovation Actions,single-stage,15 November 2023,19 March 2024 17:00:00 Brussels time
Advanced digital development tools to accelerate the development of software defined vehicles that enable zero-emission mobility (2ZERO Partnership),HORIZON-CL5-2024-D5-01-05,Call for proposal,Horizon Europe (HORIZON),Open for submission,Grant,HORIZON Research and Innovation Actions,single-stage,07 December 2023,18 April 2024 17:00:00 Brussels time
Demonstration of Technologies to minimise underwater noise generated by waterborne transport (ZEWT Partnership),HORIZON-CL5-2024-D5-01-13,Call for proposal,Horizon Europe (HORIZON),Open for submission,Grant,HORIZON Innovation Actions,single-stage,07 December 2023,18 April 2024 17:00:00 Brussels time
Pilot line(s) for 2D materials-based devices (RIA),HORIZON-CL4-2024-DIGITAL-EMERGING-01-31,Call for proposal,Horizon Europe (HORIZON),Open for submission,Grant,HORIZON Research and Innovation Actions,single-stage,15 November 2023,19 March 2024 17:00:00 Brussels time
P2R First Call for Regions and Communities,PEERS,Cascade funding,Horizon Europe (HORIZON),Open for submission,Grant,HORIZON-MISS-2021-CLIMA-02-02,single-stage,22 November 2023,27 February 2024 17:00:00 Brussels time
Restore4Life Open Call for Associated Regions,Restore4Life,Cascade funding,Horizon Europe (HORIZON),Open for submission,Grant,HORIZON-MISS-2022-OCEAN-01-02,single-stage,01 February 2024,29 May 2024 17:00:00 Brussels time
DaWetRest – CALL FOR ASSOCIATED REGIONS,DaWetRest,Cascade funding,Horizon Europe (HORIZON),Open for submission,Grant,HORIZON-MISS-2022-OCEAN-01-02,single-stage,01 January 2024,30 April 2024 17:00:00 Brussels time
Harmonised / Standard protocols for the implementation of alert and impact forecasting systems as well as transnational emergency management in the areas of high-impact weather / climatic and geological disasters,HORIZON-CL3-2024-DRS-01-03,Call for proposal,Horizon Europe (HORIZON),Forthcoming,Grant,HORIZON Innovation Actions,single-stage,27 June 2024,20 November 2024 17:00:00 Brussels time
Hi-tech capacities for crisis response and recovery after a natural-technological (NaTech) disaster,HORIZON-CL3-2024-DRS-01-04,Call for proposal,Horizon Europe (HORIZON),Forthcoming,Grant,HORIZON Research and Innovation Actions,single-stage,27 June 2024,20 November 2024 17:00:00 Brussels time
Approaches and tools for security in software and hardware development and assessment,HORIZON-CL3-2024-CS-01-01,Call for proposal,Horizon Europe (HORIZON),Forthcoming,Grant,HORIZON Innovation Actions,single-stage,27 June 2024,20 November 2024 17:00:00 Brussels time
Post-quantum cryptography transition,HORIZON-CL3-2024-CS-01-02,Call for proposal,Horizon Europe (HORIZON),Forthcoming,Grant,HORIZON Research and Innovation Actions,single-stage,27 June 2024,20 November 2024 17:00:00 Brussels time
BIM-based processes and digital twins for facilitating and optimising circular energy renovation (Built4People Partnership),HORIZON-CL5-2024-D4-02-03,Call for proposal,Horizon Europe (HORIZON),Forthcoming,Grant,HORIZON Innovation Actions,single-stage,17 September 2024,21 January 2025 17:00:00 Brussels time
"Size & weight reduction of cell and packaging of batteries system, integrating lightweight and functional materials, innovative thermal management and safe and sustainable by design approach (Batt4EU Partnership)",HORIZON-CL5-2024-D2-02-03,Call for proposal,Horizon Europe (HORIZON),Forthcoming,Grant,HORIZON Innovation Actions,single-stage,07 May 2024,5 September 2024 17:00:00 Brussels time
"Development of smart concepts of integrated energy driven bio-refineries for co-production of advanced biofuels, bio-chemicals and biomaterials",HORIZON-CL5-2024-D3-02-03,Call for proposal,Horizon Europe (HORIZON),Forthcoming,Grant,HORIZON Research and Innovation Actions,single-stage,17 September 2024,21 January 2025 17:00:00 Brussels time
Post-Li-ion technologies and relevant manufacturing techniques for mobility applications (Generation 5) (Batt4EU Partnership),HORIZON-CL5-2024-D2-02-02,Call for proposal,Horizon Europe (HORIZON),Forthcoming,Grant,HORIZON Research and Innovation Actions,single-stage,07 May 2024,5 September 2024 17:00:00 Brussels time
ERA Talents,HORIZON-WIDERA-2024-TALENTS-03-01,Call for proposal,Horizon Europe (HORIZON),Forthcoming,Grant,HORIZON Coordination and Support Actions,single-stage,11 April 2024,26 September 2024 17:00:00 Brussels time
CCU for the production of fuels,HORIZON-CL5-2024-D3-02-11,Call for proposal,Horizon Europe (HORIZON),Forthcoming,Grant,HORIZON Innovation Actions,single-stage,17 September 2024,21 January 2025 17:00:00 Brussels time
Critical technologies for the future ocean energy farms,HORIZON-CL5-2024-D3-02-04,Call for proposal,Horizon Europe (HORIZON),Forthcoming,Grant,HORIZON Research and Innovation Actions,single-stage,17 September 2024,21 January 2025 17:00:00 Brussels time
Detection and tracking of illegal and trafficked goods,HORIZON-CL3-2024-BM-01-05,Call for proposal,Horizon Europe (HORIZON),Forthcoming,Grant,HORIZON Research and Innovation Actions,single-stage,27 June 2024,20 November 2024 17:00:00 Brussels time
Resilient and secure urban planning and new tools for EU territorial entities,HORIZON-CL3-2024-INFRA-01-02,Call for proposal,Horizon Europe (HORIZON),Forthcoming,Grant,HORIZON Innovation Actions,single-stage,27 June 2024,20 November 2024 17:00:00 Brussels time
MSCA International Cooperation 2024,HORIZON-MSCA-2024-INCO-01-01,Call for proposal,Horizon Europe (HORIZON),Forthcoming,Grant,HORIZON Coordination and Support Actions,single-stage,14 May 2024,4 September 2024 17:00:00 Brussels time
Sustainable high-throughput production processes for stable lithium metal anodes for next generation batteries (Batt4EU Partnership),HORIZON-CL5-2024-D2-02-01,Call for proposal,Horizon Europe (HORIZON),Forthcoming,Grant,HORIZON Innovation Actions,single-stage,07 May 2024,5 September 2024 17:00:00 Brussels time
Market Uptake Measures of renewable energy systems,HORIZON-CL5-2024-D3-02-10,Call for proposal,Horizon Europe (HORIZON),Forthcoming,Grant,HORIZON Coordination and Support Actions,single-stage,17 September 2024,21 January 2025 17:00:00 Brussels time
MSCA COFUND 2024,HORIZON-MSCA-2024-COFUND-01-01,Call for proposal,Horizon Europe (HORIZON),Forthcoming,Grant,"HORIZON TMA MSCA Cofund Doctoral programme, HORIZON TMA MSCA Cofund Postdoctoral programme",single-stage,08 October 2024,6 February 2025 17:00:00 Brussels time
"Innovative, Community-Integrated PV systems",HORIZON-CL5-2024-D3-02-06,Call for proposal,Horizon Europe (HORIZON),Forthcoming,Grant,HORIZON Innovation Actions,single-stage,17 September 2024,21 January 2025 17:00:00 Brussels time
"Resource Efficiency of PV in Production, Use and Disposal",HORIZON-CL5-2024-D3-02-07,Call for proposal,Horizon Europe (HORIZON),Forthcoming,Grant,HORIZON Coordination and Support Actions,single-stage,17 September 2024,21 January 2025 17:00:00 Brussels time
MSCA Staff Exchanges 2024,HORIZON-MSCA-2024-SE-01-01,Call for proposal,Horizon Europe (HORIZON),Forthcoming,Grant,HORIZON TMA MSCA Staff Exchanges,single-stage,10 October 2024,5 March 2025 17:00:00 Brussels time
MSCA Doctoral Networks 2024,HORIZON-MSCA-2024-DN-01-01,Call for proposal,Horizon Europe (HORIZON),Forthcoming,Grant,"HORIZON TMA MSCA Doctoral Networks, HORIZON TMA MSCA Doctoral Networks - Industrial Doctorates, HORIZON TMA MSCA Doctoral Networks - Joint Doctorates",single-stage,29 May 2024,27 November 2024 17:00:00 Brussels time
MSCA Researchers at Risk 2024,HORIZON-MSCA-2024-RR-01-01,Call for proposal,Horizon Europe (HORIZON),Forthcoming,Grant,HORIZON Coordination and Support Actions,single-stage,12 September 2024,14 January 2025 17:00:00 Brussels time
Trans-national cooperation among Marie Skłodowska-Curie National Contact Points (NCP) 2024,HORIZON-MSCA-2024-NCP-01-01,Call for proposal,Horizon Europe (HORIZON),Forthcoming,Grant,HORIZON Coordination and Support Actions,single-stage,16 May 2024,4 September 2024 17:00:00 Brussels time
Open Topic,HORIZON-CL3-2024-DRS-01-02,Call for proposal,Horizon Europe (HORIZON),Forthcoming,Grant,HORIZON Research and Innovation Actions,single-stage,27 June 2024,20 November 2024 17:00:00 Brussels time
Tracing of cryptocurrencies transactions related to criminal purposes,HORIZON-CL3-2024-FCT-01-08,Call for proposal,Horizon Europe (HORIZON),Forthcoming,Grant,HORIZON Innovation Actions,single-stage,27 June 2024,20 November 2024 17:00:00 Brussels time
Combating hate speech online and offline,HORIZON-CL3-2024-FCT-01-05,Call for proposal,Horizon Europe (HORIZON),Forthcoming,Grant,HORIZON Innovation Actions,single-stage,27 June 2024,20 November 2024 17:00:00 Brussels time
"Integrated risk-based border control that mitigates public security risk, reduces false positives and strengthens privacy",HORIZON-CL3-2024-BM-01-04,Call for proposal,Horizon Europe (HORIZON),Forthcoming,Grant,HORIZON Innovation Actions,single-stage,27 June 2024,20 November 2024 17:00:00 Brussels time
PV-integrated electric mobility applications,HORIZON-CL5-2024-D3-02-05,Call for proposal,Horizon Europe (HORIZON),Forthcoming,Grant,HORIZON Innovation Actions,single-stage,17 September 2024,21 January 2025 17:00:00 Brussels time
Mutual learning and support scheme for national and regional innovation programmes,HORIZON-EIE-2024-CONNECT-02-02,Call for proposal,Horizon Europe (HORIZON),Forthcoming,Grant,HORIZON Coordination and Support Actions,single-stage,06 June 2024,19 September 2024 17:00:00 Brussels time
Expanding Academia-Enterprise Collaborations,HORIZON-EIE-2024-CONNECT-02-01,Call for proposal,Horizon Europe (HORIZON),Forthcoming,Grant,HORIZON Coordination and Support Actions,single-stage,06 June 2024,19 September 2024 17:00:00 Brussels time
"Advanced user-friendly, compatible, secure identity and travel document management",HORIZON-CL3-2024-BM-01-03,Call for proposal,Horizon Europe (HORIZON),Forthcoming,Grant,HORIZON Innovation Actions,single-stage,27 June 2024,20 November 2024 17:00:00 Brussels time
"Prevention, detection, response and mitigation of chemical, biological and radiological threats to agricultural production, feed and food processing, distribution and consumption",HORIZON-CL3-2024-DRS-01-01,Call for proposal,Horizon Europe (HORIZON),Forthcoming,Grant,HORIZON Research and Innovation Actions,single-stage,27 June 2024,20 November 2024 17:00:00 Brussels time
"Design for adaptability, re-use and deconstruction of buildings, in line with the principles of circular economy (Built4People Partnership)",HORIZON-CL5-2024-D4-02-04,Call for proposal,Horizon Europe (HORIZON),Forthcoming,Grant,HORIZON Research and Innovation Actions,single-stage,17 September 2024,21 January 2025 17:00:00 Brussels time
Demand-led innovation through public procurement,HORIZON-CL3-2024-SSRI-01-01,Call for proposal,Horizon Europe (HORIZON),Forthcoming,Grant,HORIZON Pre-commercial Procurement,single-stage,27 June 2024,20 November 2024 17:00:00 Brussels time
Open Topic,HORIZON-CL3-2024-FCT-01-06,Call for proposal,Horizon Europe (HORIZON),Forthcoming,Grant,HORIZON Research and Innovation Actions,single-stage,27 June 2024,20 November 2024 17:00:00 Brussels time
Open Topic,HORIZON-CL3-2024-INFRA-01-01,Call for proposal,Horizon Europe (HORIZON),Forthcoming,Grant,HORIZON Innovation Actions,single-stage,27 June 2024,20 November 2024 17:00:00 Brussels time
Interoperability for border and maritime surveillance and situational awareness,HORIZON-CL3-2024-BM-01-02,Call for proposal,Horizon Europe (HORIZON),Forthcoming,Grant,HORIZON Innovation Actions,single-stage,27 June 2024,20 November 2024 17:00:00 Brussels time
Facilitate the engagement in global ICT standardisation development (CSA),HORIZON-CL4-2024-HUMAN-01-61,Call for proposal,Horizon Europe (HORIZON),Forthcoming,Grant,HORIZON Coordination and Support Actions,single-stage,15 November 2023,19 March 2024 17:00:00 Brussels time
Explainable and Robust AI (AI Data and Robotics Partnership) (RIA),HORIZON-CL4-2024-HUMAN-01-06,Call for proposal,Horizon Europe (HORIZON),Forthcoming,Grant,HORIZON Research and Innovation Actions,single-stage,15 November 2023,19 March 2024 17:00:00 Brussels time
Advanced real-time data analysis used for infrastructure resilience,HORIZON-CL3-2024-INFRA-01-03,Call for proposal,Horizon Europe (HORIZON),Forthcoming,Grant,HORIZON Research and Innovation Actions,single-stage,27 June 2024,20 November 2024 17:00:00 Brussels time
Cost-effective sustainable technologies and crisis management strategies for RN large-scale protection of population and infrastructures after a nuclear blast or nuclear facility incident,HORIZON-CL3-2024-DRS-01-05,Call for proposal,Horizon Europe (HORIZON),Forthcoming,Grant,HORIZON Research and Innovation Actions,single-stage,27 June 2024,20 November 2024 17:00:00 Brussels time
"Robotics and other automated solutions for construction, renovation and maintenance in a sustainable built environment (Built4People Partnership)",HORIZON-CL5-2024-D4-02-02,Call for proposal,Horizon Europe (HORIZON),Forthcoming,Grant,HORIZON Research and Innovation Actions,single-stage,17 September 2024,21 January 2025 17:00:00 Brussels time
"Support for transnational activities of National Contact Points in the thematic areas of Digital, Industry and Space",HORIZON-CL4-2024-HUMAN-02-34,Call for proposal,Horizon Europe (HORIZON),Forthcoming,Grant,HORIZON Coordination and Support Actions,single-stage,03 April 2024,10 September 2024 17:00:00 Brussels time
"Minimisation of environmental, and optimisation of socio-economic impacts in the deployment, operation and decommissioning of offshore wind farms",HORIZON-CL5-2024-D3-02-08,Call for proposal,Horizon Europe (HORIZON),Forthcoming,Grant,HORIZON Research and Innovation Actions,single-stage,17 September 2024,21 January 2025 17:00:00 Brussels time
Accelerating uptake through open proposals for advanced SME innovation,HORIZON-CL3-2024-SSRI-01-02,Call for proposal,Horizon Europe (HORIZON),Forthcoming,Grant,HORIZON Innovation Actions,single-stage,27 June 2024,20 November 2024 17:00:00 Brussels time
Open Topic,HORIZON-CL3-2024-FCT-01-02,Call for proposal,Horizon Europe (HORIZON),Forthcoming,Grant,HORIZON Research and Innovation Actions,single-stage,27 June 2024,20 November 2024 17:00:00 Brussels time
CBRN-E detection capacities in small architecture,HORIZON-CL3-2024-FCT-01-07,Call for proposal,Horizon Europe (HORIZON),Forthcoming,Grant,HORIZON Innovation Actions,single-stage,27 June 2024,20 November 2024 17:00:00 Brussels time
"Lawful evidence collection in online child sexual abuse investigations, including undercover",HORIZON-CL3-2024-FCT-01-03,Call for proposal,Horizon Europe (HORIZON),Forthcoming,Grant,HORIZON Research and Innovation Actions,single-stage,27 June 2024,20 November 2024 17:00:00 Brussels time
Mitigating new threats and adapting investigation strategies in the era of Internet of Things,HORIZON-CL3-2024-FCT-01-01,Call for proposal,Horizon Europe (HORIZON),Forthcoming,Grant,HORIZON Research and Innovation Actions,single-stage,27 June 2024,20 November 2024 17:00:00 Brussels time
Open Topic,HORIZON-CL3-2024-BM-01-01,Call for proposal,Horizon Europe (HORIZON),Forthcoming,Grant,HORIZON Research and Innovation Actions,single-stage,27 June 2024,20 November 2024 17:00:00 Brussels time
Demonstrations of innovative floating wind concepts,HORIZON-CL5-2024-D3-02-09,Call for proposal,Horizon Europe (HORIZON),Forthcoming,Grant,HORIZON Innovation Actions,single-stage,17 September 2024,21 January 2025 17:00:00 Brussels time
Development of next generation synthetic renewable fuel technologies,HORIZON-CL5-2024-D3-02-02,Call for proposal,Horizon Europe (HORIZON),Forthcoming,Grant,HORIZON Research and Innovation Actions,single-stage,17 September 2024,21 January 2025 17:00:00 Brussels time
Collaborative intelligence – combining the best of machine and human (AI Data and Robotics Partnership) (RIA),HORIZON-CL4-2024-HUMAN-01-07,Call for proposal,Horizon Europe (HORIZON),Forthcoming,Grant,HORIZON Research and Innovation Actions,single-stage,15 November 2023,19 March 2024 17:00:00 Brussels time
Radicalisation and gender,HORIZON-CL3-2024-FCT-01-04,Call for proposal,Horizon Europe (HORIZON),Forthcoming,Grant,HORIZON Research and Innovation Actions,single-stage,27 June 2024,20 November 2024 17:00:00 Brussels time
Industrialisation of sustainable and circular deep renovation workflows (Built4People Partnership),HORIZON-CL5-2024-D4-02-01,Call for proposal,Horizon Europe (HORIZON),Forthcoming,Grant,HORIZON Innovation Actions,single-stage,17 September 2024,21 January 2025 17:00:00 Brussels time
Digital tools for CSP and solar thermal plants,HORIZON-CL5-2024-D3-02-01,Call for proposal,Horizon Europe (HORIZON),Forthcoming,Grant,HORIZON Innovation Actions,single-stage,17 September 2024,21 January 2025 17:00:00 Brussels time
"Digital solutions to foster participative design, planning and management of buildings, neighbourhoods and urban districts (Built4People Partnership)",HORIZON-CL5-2024-D4-02-05,Call for proposal,Horizon Europe (HORIZON),Forthcoming,Grant,HORIZON Innovation Actions,single-stage,17 September 2024,21 January 2025 17:00:00 Brussels time
European Partnership: One Health Anti-Microbial Resistance,HORIZON-HLTH-2024-DISEASE-09-01,Call for proposal,Horizon Europe (HORIZON),Forthcoming,Grant,HORIZON Programme Cofund Actions,single-stage,25 April 2024,25 September 2024 17:00:00 Brussels time
MSCA Postdoctoral Fellowships 2024,HORIZON-MSCA-2024-PF-01-01,Call for proposal,Horizon Europe (HORIZON),Forthcoming,Grant,"HORIZON TMA MSCA Postdoctoral Fellowships - European Fellowships, HORIZON TMA MSCA Postdoctoral Fellowships - Global Fellowships",single-stage,10 April 2024,11 September 2024 17:00:00 Brussels time
"Effects of disruptive changes in transport: towards resilient, safe and energy efficient mobility",HORIZON-CL5-2024-D6-01-11,Call for proposal,Horizon Europe (HORIZON),Forthcoming,Grant,HORIZON Research and Innovation Actions,single-stage,07 May 2024,5 September 2024 17:00:00 Brussels time
A new framework to improve traffic safety culture in the EU,HORIZON-CL5-2024-D6-01-12,Call for proposal,Horizon Europe (HORIZON),Forthcoming,Grant,HORIZON Research and Innovation Actions,single-stage,07 May 2024,5 September 2024 17:00:00 Brussels time
Scenario-based safety assurance of CCAM and related HMI in a dynamically evolving transport system (CCAM Partnership),HORIZON-CL5-2024-D6-01-02,Call for proposal,Horizon Europe (HORIZON),Forthcoming,Grant,HORIZON Research and Innovation Actions,single-stage,07 May 2024,5 September 2024 17:00:00 Brussels time
Orchestration of heterogeneous actors in mixed traffic within the CCAM ecosystem (CCAM Partnership),HORIZON-CL5-2024-D6-01-03,Call for proposal,Horizon Europe (HORIZON),Forthcoming,Grant,HORIZON Innovation Actions,single-stage,07 May 2024,5 September 2024 17:00:00 Brussels time
